<?xml version="1.0" encoding="UTF-8"?>
<!DOCTYPE SCENARIO SYSTEM "multiModelTrafficSimulatorInput.dtd">

<!-- (c) Arne Kesting, Ralph Germ, Martin Budden, Martin Treiber (2012) -->
<!-- TODO: FCD Output does not work with macroscopic initial conditions -->
<SCENARIO network_filename="ringroad.xodr">
  <VEHICLES write_fund_diagrams="false">
    <VEHICLE label="IDM" length="8" b_max="9" width="5.4" reaction_time="0" consumption="none">
      <LONGITUDINAL_MODEL>
        <IDM v0="30" T="1.2" s0="2" s1="0" delta="4" a="0.5" b="2.0" />
      </LONGITUDINAL_MODEL>
      <LANE_CHANGE_MODEL eur_rules="false" crit_speed_eur="25" />
      <!-- fluctuation strength needed for traffic flow breakdown if simulating only with one vehicle type -->
      <NOISE tau="5" fluct_strength="0.07" />
    </VEHICLE>
  </VEHICLES>
  <SIMULATION dt="0.07" duration="100000" fixed_seed="true" seed="42" crash_exit="true">
    <TRAFFIC_COMPOSITION>
      <VEHICLE_TYPE label="IDM" fraction="1" relative_v0_randomization="0.0" route_label="" />
    </TRAFFIC_COMPOSITION>
    <ROAD id="1" logging="false">
      <INITIAL_CONDITIONS>
        <!-- critical density for emerging stop-and-go wave about >= 33 vehicles per km per lane -->
        <IC_MACRO x="1" rho_per_km="36" v="20" />
      </INITIAL_CONDITIONS>
    </ROAD>
    <OUTPUT>
      <FLOATING_CAR_DATA n_dt="5" dn="0">
        <FC number="2" />
      </FLOATING_CAR_DATA>
    </OUTPUT>
  </SIMULATION>
</SCENARIO>

