<?xml version="1.0" encoding="UTF-8"?>
<!DOCTYPE SCENARIO SYSTEM "multiModelTrafficSimulatorInput.dtd">

<!-- (c) Movsim, Arne Kesting 2012 -->
<SCENARIO network_filename="startStop_all_ca.xodr">
    <VEHICLES write_fund_diagrams="false">
        <!-- vehicle length ==> cell units -->
        <VEHICLE label="NSM1" length="1" width="4.4" b_max="10000" reaction_time="0" consumption="none">
            <LONGITUDINAL_MODEL>
                <NSM v0="2" p_slowdown="0.1" p_slow_start="0.1" />
            </LONGITUDINAL_MODEL>
            <LANE_CHANGE_MODEL eur_rules="false" crit_speed_eur="25" />
        </VEHICLE>
        <VEHICLE label="BARL1" length="1" width="4.4" b_max="10000" reaction_time="0" consumption="none">
            <LONGITUDINAL_MODEL>
                <NSM v0="2" p_slowdown="0.1" p_slow_start="0.2" />
            </LONGITUDINAL_MODEL>
            <LANE_CHANGE_MODEL eur_rules="false" crit_speed_eur="25" />
        </VEHICLE>
        <VEHICLE label="KKW1" length="20" width="4.4" b_max="10000" reaction_time="0" consumption="none">
            <LONGITUDINAL_MODEL>
                <KKW v0="28" k="2.55" pb0="0.425" pb1="0.04" pa1="0.2" pa2="0.052" vp="14" />
            </LONGITUDINAL_MODEL>
            <LANE_CHANGE_MODEL eur_rules="false" crit_speed_eur="25" />
        </VEHICLE>
        <VEHICLE label="ObstacleNSM" length="1" width="4.4" b_max="10000" reaction_time="0" consumption="none">
            <LONGITUDINAL_MODEL>
                <NSM v0="0" p_slowdown="0" p_slow_start="0" />
            </LONGITUDINAL_MODEL>
            <LANE_CHANGE_MODEL eur_rules="false" crit_speed_eur="25" />
        </VEHICLE>
        <VEHICLE label="ObstacleKKW" length="20" width="4.4" b_max="10000" reaction_time="0" consumption="none">
            <LONGITUDINAL_MODEL>
                <KKW v0="0" k="2.55" pb0="0.425" pb1="0.04" pa1="0.2" pa2="0.052" vp="14" />
            </LONGITUDINAL_MODEL>
            <LANE_CHANGE_MODEL eur_rules="false" crit_speed_eur="25" />
        </VEHICLE>
    </VEHICLES>
    <SIMULATION dt="1" duration="150" fixed_seed="true" seed="42" crash_exit="false">
        <TRAFFIC_COMPOSITION>
            <VEHICLE_TYPE label="NSM1" fraction="1" relative_v0_randomization="0.0" route_label="" />
            <VEHICLE_TYPE label="BARL1" fraction="1" relative_v0_randomization="0.0" route_label="" />
            <VEHICLE_TYPE label="KKW1" fraction="1" relative_v0_randomization="0.0" route_label="" />
            <!-- KKW and NSM not compatible. Obstacle works only for same model -->
            <VEHICLE_TYPE label="ObstacleNSM" fraction="0" relative_v0_randomization="0.0" route_label="" />
            <VEHICLE_TYPE label="ObstacleKKW" fraction="0" relative_v0_randomization="0.0" route_label="" />
        </TRAFFIC_COMPOSITION>
        <ROAD id="Nagel Schreckenberg Model. Cell length: 7.5 m" logging="false">
            <INITIAL_CONDITIONS>
                <!-- in physical quantities (meter and m/s) -->
                <IC_MICRO x="7.5" v="0" label="NSM1" lane="1" />
                <IC_MICRO x="15.0" v="0" label="NSM1" lane="1" />
                <IC_MICRO x="22.5" v="0" label="NSM1" lane="1" />
                <IC_MICRO x="30.0" v="0" label="NSM1" lane="1" />
                <IC_MICRO x="37.5" v="0" label="NSM1" lane="1" />
                <IC_MICRO x="45.0" v="0" label="NSM1" lane="1" />
                <IC_MICRO x="52.5" v="0" label="NSM1" lane="1" />
                <IC_MICRO x="60.0" v="0" label="NSM1" lane="1" />
                <IC_MICRO x="67.5" v="0" label="NSM1" lane="1" />
                <IC_MICRO x="75.0" v="0" label="NSM1" lane="1" />
                <IC_MICRO x="82.5" v="0" label="NSM1" lane="1" />
                <IC_MICRO x="90.0" v="0" label="NSM1" lane="1" />
                <IC_MICRO x="97.5" v="0" label="NSM1" lane="1" />
                <IC_MICRO x="105.0" v="0" label="NSM1" lane="1" />
                <IC_MICRO x="112.5" v="0" label="NSM1" lane="1" />
                <IC_MICRO x="120.0" v="0" label="NSM1" lane="1" />
                <IC_MICRO x="127.5" v="0" label="NSM1" lane="1" />
                <IC_MICRO x="135.0" v="0" label="NSM1" lane="1" />
                <IC_MICRO x="142.5" v="0" label="NSM1" lane="1" />
                <IC_MICRO x="150.0" v="0" label="NSM1" lane="1" />
                <IC_MICRO x="157.5" v="0" label="NSM1" lane="1" />
                <IC_MICRO x="165.0" v="0" label="NSM1" lane="1" />
                <IC_MICRO x="172.5" v="0" label="NSM1" lane="1" />
                <IC_MICRO x="180.0" v="0" label="NSM1" lane="1" />
                <IC_MICRO x="187.5" v="0" label="NSM1" lane="1" />
                <IC_MICRO x="195.0" v="0" label="NSM1" lane="1" />
                <IC_MICRO x="1000" v="0" label="ObstacleNSM" lane="1" />
            </INITIAL_CONDITIONS>
        </ROAD>
        <ROAD id="Barlovic Model. Cell length: 7.5m" logging="false">
            <INITIAL_CONDITIONS>
                <!-- in physical quantities (meter and m/s) -->
                <IC_MICRO x="7.5" v="0" label="BARL1" lane="1" />
                <IC_MICRO x="15.0" v="0" label="BARL1" lane="1" />
                <IC_MICRO x="22.5" v="0" label="BARL1" lane="1" />
                <IC_MICRO x="30.0" v="0" label="BARL1" lane="1" />
                <IC_MICRO x="37.5" v="0" label="BARL1" lane="1" />
                <IC_MICRO x="45.0" v="0" label="BARL1" lane="1" />
                <IC_MICRO x="52.5" v="0" label="BARL1" lane="1" />
                <IC_MICRO x="60.0" v="0" label="BARL1" lane="1" />
                <IC_MICRO x="67.5" v="0" label="BARL1" lane="1" />
                <IC_MICRO x="75.0" v="0" label="BARL1" lane="1" />
                <IC_MICRO x="82.5" v="0" label="BARL1" lane="1" />
                <IC_MICRO x="90.0" v="0" label="BARL1" lane="1" />
                <IC_MICRO x="97.5" v="0" label="BARL1" lane="1" />
                <IC_MICRO x="105.0" v="0" label="BARL1" lane="1" />
                <IC_MICRO x="112.5" v="0" label="BARL1" lane="1" />
                <IC_MICRO x="120.0" v="0" label="BARL1" lane="1" />
                <IC_MICRO x="127.5" v="0" label="BARL1" lane="1" />
                <IC_MICRO x="135.0" v="0" label="BARL1" lane="1" />
                <IC_MICRO x="142.5" v="0" label="BARL1" lane="1" />
                <IC_MICRO x="150.0" v="0" label="BARL1" lane="1" />
                <IC_MICRO x="157.5" v="0" label="BARL1" lane="1" />
                <IC_MICRO x="165.0" v="0" label="BARL1" lane="1" />
                <IC_MICRO x="172.5" v="0" label="BARL1" lane="1" />
                <IC_MICRO x="180.0" v="0" label="BARL1" lane="1" />
                <IC_MICRO x="187.5" v="0" label="BARL1" lane="1" />
                <IC_MICRO x="195.0" v="0" label="BARL1" lane="1" />
                <IC_MICRO x="1000" v="0" label="ObstacleNSM" lane="1" />
            </INITIAL_CONDITIONS>
        </ROAD>
        <ROAD id="Kerner Klenov Wolf Model. Cell length: 0.5m" logging="false">
            <INITIAL_CONDITIONS>
                <!-- in physical quantities (meter and m/s) -->
                <IC_MICRO x="10" v="0" label="KKW1" lane="1" />
                <IC_MICRO x="20" v="0" label="KKW1" lane="1" />
                <IC_MICRO x="30" v="0" label="KKW1" lane="1" />
                <IC_MICRO x="40" v="0" label="KKW1" lane="1" />
                <IC_MICRO x="50" v="0" label="KKW1" lane="1" />
                <IC_MICRO x="60" v="0" label="KKW1" lane="1" />
                <IC_MICRO x="70" v="0" label="KKW1" lane="1" />
                <IC_MICRO x="80" v="0" label="KKW1" lane="1" />
                <IC_MICRO x="90" v="0" label="KKW1" lane="1" />
                <IC_MICRO x="100" v="0" label="KKW1" lane="1" />
                <IC_MICRO x="110" v="0" label="KKW1" lane="1" />
                <IC_MICRO x="120" v="0" label="KKW1" lane="1" />
                <IC_MICRO x="130" v="0" label="KKW1" lane="1" />
                <IC_MICRO x="140" v="0" label="KKW1" lane="1" />
                <IC_MICRO x="150" v="0" label="KKW1" lane="1" />
                <IC_MICRO x="160" v="0" label="KKW1" lane="1" />
                <IC_MICRO x="170" v="0" label="KKW1" lane="1" />
                <IC_MICRO x="180" v="0" label="KKW1" lane="1" />
                <IC_MICRO x="190" v="0" label="KKW1" lane="1" />
                <IC_MICRO x="200" v="0" label="KKW1" lane="1" />
                <IC_MICRO x="210" v="0" label="KKW1" lane="1" />
                <IC_MICRO x="220" v="0" label="KKW1" lane="1" />
                <IC_MICRO x="230" v="0" label="KKW1" lane="1" />
                <IC_MICRO x="240" v="0" label="KKW1" lane="1" />
                <IC_MICRO x="250" v="0" label="KKW1" lane="1" />
                <IC_MICRO x="1000" v="0" label="ObstacleKKW" lane="1" />
            </INITIAL_CONDITIONS>
        </ROAD>
        <OUTPUT />
    </SIMULATION>
</SCENARIO>

